experiments/syn_data2/estimated_param/pixel_param.json

{
    "label_set": [
        0,
        1,
        2
    ],
    "channels": 1,
    "mean": [
        [
            101.59496998061559
        ],
        [
            149.5398858770216
        ],
        [
            149.5122690687831
        ]
    ],
    "variance": [
        [
            [
                4155.890962885599
            ]
        ],
        [
            [
                399.05644861513036
            ]
        ],
        [
            [
                400.535118134854
            ]
        ]
    ],
    "std": [
        [
            64.46620015857611
        ],
        [
            19.976397288178127
        ],
        [
            20.01337348212075
        ]
    ]
}

syn_data2/experiment_summary_syn_data2.md

### ピクセル値分布パラメータ $\hat{\bm{\theta}}$

- ラベル0: $\hat{\mu}_0=101.5950$, $\hat{\sigma}_0=64.4662$
- ラベル1: $\hat{\mu}_1=149.5399$, $\hat{\sigma}_1=19.9764$
- ラベル2: $\hat{\mu}_2=149.5123$, $\hat{\sigma}_2=20.0134$